594	10.1016/j.neuroimage.2009.12.112		2015-09-16T16:44:08.302079Z	Svenja Caspers, Karl Zilles, Angela R. Laird and Simon B. Eickhoff					We investigated the neural correlates of action observation and imitation in the human brain, based on 139 functional imaging studies. For both types of task, bilateral networks were found. These did not only involve classic mirror neuron areas such as inferior frontal and inferior parietal cortex, but also dorsal premotor, superior parietal, posterior superior temporal and extrastriate visual areas. Additional analyses revealed the influence of effector used during the action, the instruction given to the subjects, and the involvement of objects during the action. This dataset was automatically imported from the ANIMA <http://anima.modelgui.org/> database. Version: 1	2015-09-16T16:44:08.301223Z	http://neurovault.org/collections/824/download					http://anima.modelgui.org/studies/Caspers_ActionImitationObservation_2010															824								NeuroImage					2016-02-29T09:35:46.351397Z					ALE meta-analysis of action observation and imitation in the human brain			3									555	ANIMA	http://linkinghub.elsevier.com/retrieve/pii/S1053811909014013																							http://neurovault.org/collections/824/												
598	10.1016/j.neuroimage.2009.03.014		2014-06-04T15:36:05.681384Z	Keith J. Duncan, Chotiga Pattamadilok, Iris Knierim and Joseph T. Devlin			vsochat		OpenfMRI ds000107	2014-06-04T15:36:05.681384Z	http://neurovault.org/collections/46/download			1.5		https://openfmri.org/dataset/ds000107															46								NeuroImage					2016-01-27T21:41:34.269282Z					Consistency and variability in functional localisers			6									1	ChrisFiloGorgolewski	http://linkinghub.elsevier.com/retrieve/pii/S1053811909002353							Siemens																http://neurovault.org/collections/46/												
603	10.1016/j.bbi.2015.12.018		2015-09-10T11:50:34.012626Z	Mats Lekander, Bianka Karshikoff, Emilia Johansson, Anne Soop, Peter Fransson, Johan N. Lundström, Anna Andreasson, Martin Ingvar, Predrag Petrovic, John Axelsson and Gustav Nilsonne					Task-based fMRI has been used to study the effects of experimental inflammation on the human brain, but it remains unknown whether intrinsic connectivity in the brain at rest changes during a sickness response. Here, we investigated the effect of experimental inflammation on connectivity between areas relevant for monitoring of bodily states, motivation, and subjective symptoms of sickness. In a double-blind randomized controlled experiment, 52 healthy volunteers were injected with 0.6 ng/kg LPS (lipopolysaccharide) or placebo, and participated in a resting state fMRI experiment after approximately 2 h 45 min. Resting state fMRI data were available from 48 participants, of which 28 received LPS and 20 received placebo. Bilateral anterior and bilateral posterior insula sections were used as seed regions and connectivity with bilateral orbitofrontal and cingulate (anterior and middle) cortices was investigated. Back pain, headache and global sickness increased significantly after as compared to before LPS, while a non-significant trend was shown for increased nausea. Compared to placebo, LPS was followed by increased connectivity between left anterior insula and left midcingulate cortex. This connectivity was significantly correlated to increase in back pain after LPS and tended to be related to increased global sickness, but was not related to increased headache or nausea. LPS did not affect the connectivity from other insular seeds. In conclusion, the finding of increased functional connectivity between left anterior insula and middle cingulate cortex suggests a potential neurophysiological mechanism that can be further tested to understand the subjective feeling of malaise and discomfort during a sickness response.	2016-01-27T20:01:04.853843Z	http://neurovault.org/collections/807/download			3.0																	807								Brain, Behavior, and Immunity					2016-04-20T15:43:27.542880Z					Intrinsic functional connectivity of insular cortex and symptoms of sickness during acute experimental inflammation			8									548	gustav.nilsonne	http://linkinghub.elsevier.com/retrieve/pii/S0889159115300805																							http://neurovault.org/collections/807/												
605	10.1002/hbm.22745	55	2015-01-26T13:14:21.462931Z	Jiaojian Wang, Lingzhong Fan, Yinyan Wang, Wenting Xu, Tao Jiang, Peter T. Fox, Simon B. Eickhoff, Chunshui Yu and Tianzi Jiang		FSL		mni	The overlap of parcellation results for Wernicke's area in the manuscript (Figure 1C).	2015-01-26T13:14:21.462931Z	http://neurovault.org/collections/321/download	10000.0	256.0	3.0	13.0		True		False	no								right			321	None of the partici-pants had ever suffered from any psychiatric or neurologi-cal disease, and none had any contraindications for MRI scanning.							Human Brain Mapping				256.0	2016-02-29T09:28:30.967605Z					Determination of the posterior boundary of Wernicke's area based on multimodal connectivity profiles			4	0.0	0.0	T1				FSL-SPM		282	jiaojianwang	http://doi.wiley.com/10.1002/hbm.22745	acceleration factor of 2 	50.0	single-shot 			1.0	General Electric	echo planar imaging		3.0				FSL, SPM	FSL4.1, SPM8	25.0	22.7	19.0	1.0	MNI152		other	http://neurovault.org/collections/321/	True			False							False	
610	10.1016/j.neubiorev.2016.04.020		2016-05-08T19:56:06.701568Z	I. García-García, J. Kube, M. Gaebler, A. Horstmann, A. Villringer and J. Neumann					Brain regions consistently activated by the contrast negative visual stimuli > neutral control stimuli as obtained using ALE meta-analysis (p<.05 FWE-corrected). 	2016-05-08T19:56:06.701105Z	http://neurovault.org/collections/1351/download																				1351								Neuroscience & Biobehavioral Reviews					2016-05-08T19:58:11.137437Z					Neural processing of negative emotional stimuli and the influence of age, sex and and task-related characteristics			1									224	IGarcia	http://linkinghub.elsevier.com/retrieve/pii/S0149763415302025																							http://neurovault.org/collections/1351/												
611	10.1038/npp.2016.43		2016-02-12T17:39:21.443680Z	Guillaume Sescousse, Lieneke K Janssen, Mahur M Hashemi, Monique HM Timmer, Dirk EM Geurts, Niels P ter Huurne, Luke Clark and Roshan Cools					"These T-maps describe the main results of a pharmaco-fMRI experiment regarding the brain responses to near-miss events in a slot machine gambling game, in both healthy controls (n = 22) and pathological gamblers (n = 22).
Since the pharmacological manipulation (dopamine D2 receptor antagonist sulpiride) did not have any detectable effect on either behavior or brain responses, all T-maps describe results across drug sessions."	2016-03-25T11:24:49.147008Z	http://neurovault.org/collections/1186/download								True	healthy controls vs pathological gamblers								right			1186								Neuropsychopharmacology					2016-03-25T11:25:08.301738Z					Amplified Striatal Responses to Near-Miss Outcomes in Pathological Gamblers			6		0.0							124	gsescousse	http://www.nature.com/doifinder/10.1038/npp.2016.43																	34.0						http://neurovault.org/collections/1186/												
612	10.3389/fnins.2012.00080		2014-06-04T15:05:48.648382Z	Tom Schonberg, Craig R. Fox, Jeanette A. Mumford, Eliza Congdon, Christopher Trepel and Russell A. Poldrack			vsochat		OpenfMRI ds000001	2014-06-04T15:05:48.648382Z	http://neurovault.org/collections/39/download			3.0		https://openfmri.org/dataset/ds000001															39								Frontiers in Neuroscience					2016-01-27T21:47:49.746746Z					Decreasing Ventromedial Prefrontal Cortex Activity During Sequential Risk-Taking: An fMRI Investigation of the Balloon Analog Risk Task			16									1	ChrisFiloGorgolewski	http://journal.frontiersin.org/article/10.3389/fnins.2012.00080/abstract							Siemens	Allegra															http://neurovault.org/collections/39/												
613	10.1016/j.neuron.2015.03.019		2015-04-09T17:22:16.289264Z	Shinsuke Suzuki, Ryo Adachi, Simon Dunne, Peter Bossaerts and John P. O’Doherty					Suzuki et al. (Neuron, 2015)	2015-04-09T17:22:16.289264Z	http://neurovault.org/collections/507/download																				507								Neuron					2016-06-12T23:00:13.030149Z					Neural Mechanisms Underlying Human Consensus Decision-Making			10									369	szkshnsk	http://linkinghub.elsevier.com/retrieve/pii/S0896627315002159																							http://neurovault.org/collections/507/												
617	10.3389/fnagi.2015.00242		2015-12-10T16:15:27.746618Z	Angela Tam, Christian Dansereau, AmanPreet Badhwar, Pierre Orban, Sylvie Belleville, Howard Chertkow, Alain Dagher, Alexandru Hanganu, Oury Monchi, Pedro Rosa-Neto, Amir Shmuel, Seqian Wang, John Breitner and Pierre Bellec				mni	"This release contains the following files:

1) brain_parcellation_mcinet_basc_(sym,asym)_XXclusters.nii.gz: 3D volumes at 3 mm isotropic resolution, in the MNI non-linear 2009a space (http://www.bic.mni.mcgill.ca/ServicesAtlases/ICBM152NLin2009), at multiple resolutions of clusters. 
Note that two versions of the templates are available, sym and asym.  The asym flavor contains brain images that have been registered in the asymmetric version of the MNI brain template (reflecting that the brain is asymmetric), while with the sym flavor they have been registered in the symmetric version of the MNI template. 

2) ttest_ctrlvsmci_seedXX.nii.gz: 3D volumes displaying functional connectivity differences (uncorrected t-tests) between patients with mild cognitive impairment (MCI) and cognitively normal elderly, for 4 different seeds/regions of interest. "	2015-12-24T22:39:44.088409Z	http://neurovault.org/collections/1003/download			3.0			True		True	mild cognitive impairment patients vs cognitively normal elderly											1003								Frontiers in Aging Neuroscience					2016-01-27T20:58:03.765944Z					Common Effects of Amnestic Mild Cognitive Impairment on Resting-State Connectivity Across Four Independent Studies			20		27.0	T1						824	angela.tam08	http://journal.frontiersin.org/article/10.3389/fnagi.2015.00242		0.38					Siemens, Philips							NeuroImaging Analysis Kit	0.12.18		72.0						http://neurovault.org/collections/1003/												
618	10.1371/journal.pone.0097176		2013-09-05T09:18:10.000122Z	Krzysztof J. Gorgolewski, Dan Lurie, Sebastian Urchs, Judy A. Kipping, R. Cameron Craddock, Michael P. Milham, Daniel S. Margulies, Jonathan Smallwood					To understand the relationship between self-generated mental activity and intrinsic neural fluctuations, we developed the New York Cognition Questionnaire (NYC-Q) to access the content and form of an individual's experiences during the acquisition of resting-state functional magnetic resonance imaging data. The self-report assessment and imaging data were collected as a part of the Nathan Kline Rockland Enhanced sample, which is a large-scale community sample of both phenotypic and neuroimaging data that is being openly shared as it is acquired. We decomposed NYC-Q scores using exploratory factor analysis and used these components to explore relationships between types of spontaneous thought and measures of intrinsic brain activity, specifically fractional amplitude of low frequency fluctuations, regional homogeneity, and degree centrality.	2013-09-05T09:18:10.000122Z	http://neurovault.org/collections/16/download																				16								PLoS ONE					2016-02-06T19:30:36.169067Z					A Correspondence between Individual Differences in the Brain's Intrinsic Functional Architecture and the Content and Form of Self-Generated Thoughts			30	1.0	3.0							1	ChrisFiloGorgolewski	http://dx.plos.org/10.1371/journal.pone.0097176																60.0		18.0				other	http://neurovault.org/collections/16/												
620	10.1038/35107080		2014-06-04T15:19:06.799631Z	R. A. Poldrack, J. Clark, E. J. Paré-Blagoev, D. Shohamy, J. Creso Moyano, C. Myers and M. A. Gluck			vsochat		OpenfMRI ds000052	2014-06-04T15:19:06.799631Z	http://neurovault.org/collections/44/download					https://openfmri.org/dataset/ds000052															44								Nature					2016-01-27T21:46:45.884872Z					Interactive memory systems in the human brain			5									1	ChrisFiloGorgolewski	http://www.nature.com/doifinder/10.1038/35107080							Siemens	Allegra															http://neurovault.org/collections/44/												
622	10.1523/JNEUROSCI.0786-13.2013		2013-09-09T18:22:03.598069Z	B. Baird, J. Smallwood, K. J. Gorgolewski and D. S. Margulies					This study examined the relationship between resting state functional connectivity of medial and lateral regions of anterior prefrontal cortex to metacognitive ability in the domains of perception and memory. 	2013-09-09T18:22:03.598069Z	http://neurovault.org/collections/17/download	30.0	256.0		90.0				False												17								Journal of Neuroscience				64.0	2016-01-27T21:47:46.204531Z					Medial and Lateral Networks in Anterior Prefrontal Cortex Support Metacognitive Ability for Memory and Perception			3		3.0				interleaved			31	BenBaird	http://www.jneurosci.org/cgi/doi/10.1523/JNEUROSCI.0786-13.2013		0.4			2000.0		Siemens	Verio and Tim Trio								46.0	27.0	19.0				other	http://neurovault.org/collections/17/												
628	10.1111/ejn.13392		2016-01-12T14:18:00.558758Z	Rainer Kujala, Enrico Glerean, Raj Kumar Pan, Iiro P. Jääskeläinen, Mikko Sams and Jari Saramäki						2016-09-13T04:26:43.977204Z	http://neurovault.org/collections/1080/download																				1080								European Journal of Neuroscience					2016-09-14T01:41:20.388151Z					Graph coarse-graining reveals differences in the module-level structure of functional brain networks			21									101	e.glerean	http://doi.wiley.com/10.1111/ejn.13392																							http://neurovault.org/collections/1080/												
630	10.1503/jpn.130080	AC-PC (auto)	2014-11-10T21:28:48.651787Z	Michael Gaebler, Judith Daniels, Jan-Peter Lamke, Thomas Fydrich and Henrik Walter	AR(1)			mni	Behavioural and neural correlates of self-focused emotion regulation in social anxiety disorder	2014-11-10T21:28:48.651787Z	http://neurovault.org/collections/206/download	25.0	192.0	3.0	80.0		True		True	Patients with social anxiety disorder relative to matched healthy controls		randommixedeffects		two-sample t-test		False		right	SPM default	128 s (SPM default)	206								Journal of Psychiatry & Neuroscience		623.0	25	64.0	2016-01-27T21:48:04.447253Z			first scan of session		Behavioural and neural correlates of self-focused emotion regulation in social anxiety disorder		24.0	7	3.0	2.0				descending	realignment (to 1st scan), unwarp (fieldmap), coreg (T1-->meanEPI), segment, DARTEL normalization to group template (incl. smoothing)		29	MichaelGaebler	http://jpn.ca/		24.0	EPI	ArtRepair for excessive head movement and signal dropout	2250.0		Siemens	TIM Trio	0.6	3.6		6.0	Gaussian	SPM	8		30.0					eventrelated	http://neurovault.org/collections/206/	True	False	True	True	True	True		False	False	False	True	False
631	10.1523/JNEUROSCI.0152-11.2011		2014-08-21T14:29:38.046226Z	M. R. Uncapher, J. B. Hutchinson and A. D. Wagner			vsochat		OpenfMRI ds000110	2014-08-21T14:29:38.046226Z	http://neurovault.org/collections/101/download			3.0		https://openfmri.org/dataset/ds000110															101								Journal of Neuroscience					2016-01-27T21:47:52.573900Z					Dissociable Effects of Top-Down and Bottom-Up Attention during Episodic Encoding			26									1	ChrisFiloGorgolewski	http://www.jneurosci.org/cgi/doi/10.1523/JNEUROSCI.0152-11.2011							Signa																http://neurovault.org/collections/101/												
632	10.1523/JNEUROSCI.5511-11.2012		2015-03-06T01:40:45.132427Z	J. M. Moran, E. Jolly and J. P. Mitchell					OpenfMRI ds000109. Participants read stories and answered questions that referred to either a person's false belief (mental trials) or to outdated physical representations, such as an old photograph (physical trials). Participants saw twelve stories of each type across two functional runs.	2015-03-06T01:40:45.132427Z	http://neurovault.org/collections/426/download			3.0		https://openfmri.org/dataset/ds000109															426								Journal of Neuroscience					2016-01-27T21:46:49.781419Z					Social-Cognitive Deficits in Normal Aging			8									186	vsochat	http://www.jneurosci.org/cgi/doi/10.1523/JNEUROSCI.5511-11.2012							Siemens	Tim Trio															http://neurovault.org/collections/426/												
633	10.1038/sdata.2016.3		2016-02-03T19:40:29.742955Z	Cyril R. Pernet, Krzysztof J. Gorgolewski, Dominic Job, David Rodriguez, Ian Whittle and Joanna Wardlaw						2016-02-03T19:43:03.515471Z	http://neurovault.org/collections/1158/download					http://dx.doi.org/10.5255/UKDA-SN-851861															1158								Scientific Data					2016-02-04T03:23:54.904493Z					A structural and functional magnetic resonance imaging dataset of brain tumour patients			1									1	ChrisFiloGorgolewski	http://www.nature.com/articles/sdata20163																							http://neurovault.org/collections/1158/												
634	10.1073/pnas.0602659103		2014-06-04T15:14:22.039247Z	K. Foerde, B. J. Knowlton and R. A. Poldrack			vsochat		OpenfMRI ds000011	2014-06-04T15:14:22.039247Z	http://neurovault.org/collections/43/download			3.0		https://openfmri.org/dataset/ds000011															43								Proceedings of the National Academy of Sciences					2016-01-27T21:47:47.390440Z					Modulation of competing memory systems by distraction			10									1	ChrisFiloGorgolewski	http://www.pnas.org/cgi/doi/10.1073/pnas.0602659103							Siemens	Allegra, head-only															http://neurovault.org/collections/43/												
635	10.1016/j.dib.2016.02.071		2015-11-23T12:41:55.089483Z	Thomas C. Emmerling, Jan Zimmermann, Bettina Sorger, Martin Frost and Rainer Goebel				mni	We show data of a time-resolved searchlight analysis for 12 individual subjects performing a visual motion imagery task. In each searchlight sphere a multi-voxel pattern analysis (MVPA) is performed to decode four different directions of imagined motion. This is done for six different but overlapping time windows with respect to the onset of an imagery trial. The resulting volumetric maps show p-values for FDR-corrected Chi-square tests of the confusion matrices of each searchlight sphere.	2016-03-07T09:28:04.503569Z	http://neurovault.org/collections/961/download	23.0		7.0	70.0		True	template-based normalization using BrainVoyager 20	False												961	motion, localizer activation							Data in Brief		574.0	variable	146.0	2016-06-19T03:18:36.511346Z	trilinear and sinc		first volume of first functional scan	BrainVoyager	Time-resolved searchlight analysis of imagined visual motion using 7T ultra-high field fMRI: Data on interindividual differences		40.0	72	4.0	3.0					motion correction, EPI distortion correction, temporal filtering, coregistration		586	thomasemmerling	http://linkinghub.elsevier.com/retrieve/pii/S2352340916300932	multi-band factor 2	0.5	Gradient Echo EPI		2000.0	1.0	Siemens	7T	0.0	1.100001				BrainVoyager	2.8.4	45.0	26.82	20.0	1.0	ICBM 452		hybridblockevent	http://neurovault.org/collections/961/				False	True					False	False	
636	10.1093/brain/aww005		2016-03-16T13:43:13.544974Z	Lorna Harper, Giorgio G. Fumagalli, Frederik Barkhof, Philip Scheltens, John T. O’Brien, Femke Bouwman, Emma J. Burton, Jonathan D. Rohrer, Nick C. Fox, Gerard R. Ridgway and Jonathan M. Schott					Several visual rating scales have been developed specifically to rate brain regions vulnerable to atrophy in a range of different dementias. Using structural magnetic resonance scans from healthy individuals and a large sample of patients with a histopathological diagnosis of dementia, this data explores the relationship between each visual rating scale and the pattern of grey matter volume loss.	2016-03-30T09:59:39.144416Z	http://neurovault.org/collections/1255/download																				1255								Brain					2016-03-30T09:59:47.884768Z					MRI visual rating scales in the diagnosis of dementia: evaluation in 184 post-mortem confirmed cases			6									957	lorna.harper.11@ucl.ac.uk	http://www.brain.oxfordjournals.org/lookup/doi/10.1093/brain/aww005																							http://neurovault.org/collections/1255/												
638	10.3389/fnins.2015.00063		2015-03-07T16:32:34.657076Z	Mei-Yen Chen, Koji Jimura, Corey N. White, W. Todd Maddox and Russell A. Poldrack			vsochat, RussPoldrack			2015-03-07T16:32:34.657076Z	http://neurovault.org/collections/431/download																				431								Frontiers in Neuroscience					2016-06-12T21:43:33.554688Z					Multiple brain networks contribute to the acquisition of bias in perceptual decision-making			6									1	ChrisFiloGorgolewski	http://journal.frontiersin.org/article/10.3389/fnins.2015.00063																							http://neurovault.org/collections/431/												
642	10.1126/science.1171599		2015-06-22T09:49:12.046564Z	A. Knops, B. Thirion, E. M. Hubbard, V. Michel and S. Dehaene			bthirion, gael.varoquaux		Throughout the history of mathematics, concepts of number and space have been tightly intertwined. We tested the hypothesis that cortical circuits for spatial attention contribute to mental arithmetic in humans. We trained a multivariate classifier algorithm to infer the direction of an eye movement, left or right, from the brain activation measured in the posterior parietal cortex. Without further training, the classifier then generalized to an arithmetic task. Its left versus right classification could be used to sort out subtraction versus addition trials, whether performed with symbols or with sets of dots. These findings are consistent with the suggestion that mental arithmetic co-opts parietal circuitry associated with spatial coding. 	2015-06-22T09:49:12.046564Z	http://neurovault.org/collections/656/download																				656								Science					2016-01-27T22:00:53.227193Z					Recruitment of an Area Involved in Eye Movements During Mental Arithmetic			34									470	schwarty	http://www.sciencemag.org/cgi/doi/10.1126/science.1171599																							http://neurovault.org/collections/656/												
643	10.1016/j.neuroimage.2014.06.033		2014-08-24T10:24:43.378474Z	Erik Ziegler, Maud Rouillard, Elodie André, Tim Coolen, Johan Stender, Evelyne Balteau, Christophe Phillips and Gaëtan Garraux				mni	Here, we applied a novel diffusion-weighted imaging approach-track density imaging (TDI). Twenty-seven non-demented Parkinson's patients (mean disease duration: 5years, mean score on the Hoehn & Yahr scale=1.5) were compared with 26 elderly controls matched for age, sex, and education level. Track density images were created by sampling each subject's spatially normalized fiber tracks in 1mm isotropic intervals and counting the fibers that passed through each voxel. Whole-brain voxel-based analysis was performed and significance was assessed with permutation testing. Statistically significant increases in track density were found in the Parkinson's patients, relative to controls. Clusters were distributed in disease-relevant areas including motor, cognitive, and limbic networks. From the lower medulla to the diencephalon and striatum, clusters encompassed the known location of the locus coeruleus and pedunculopontine nucleus in the pons, and from the substantia nigra up to medial aspects of the posterior putamen, bilaterally. The results identified in brainstem and nigrostriatal pathways show a large overlap with the known distribution of neuropathological changes in non-demented PD patients. Our results also support an early involvement of limbic and cognitive networks in Parkinson's disease.	2014-08-24T10:24:43.378474Z	http://neurovault.org/collections/104/download	91.0	211.0	3.0			False		True	Parkinson's Disease vs. Healthy Controls				t-Test	TFCE			both			104		Linear	ANTs	nonlinear				NeuroImage				7744.0	2016-01-27T22:00:53.294497Z					Mapping track density changes in nigrostriatal and extranigral pathways in Parkinson's disease	Greedy symmetric diffeomorphic normalization (SyN)		2		10.0	Average pathlength map						106	swederik	http://linkinghub.elsevier.com/retrieve/pii/S1053811914005102	Twice-refocused spin-echo sequence with EPI readout at two distinct b-values (b=1000, b=2500 s/mm2) along 120 encoding gradients	0.53			6800.0	1.0	Siemens	Magnetom Allegra	0.0	2.4				Nipype	0.9	81.0	65.0	47.0	1.0	MNI152_T1_1mm_brain	Cross-correlation	other	http://neurovault.org/collections/104/				True							False	
