699	10.1523/JNEUROSCI.2467-12.2012		2015-06-22T09:43:33.394635Z	B. Gauthier, E. Eger, G. Hesselmann, A.-L. Giraud and A. Kleinschmidt			bthirion, gael.varoquaux		Both our environment and our behavior contain many spatiotemporal regularities. Preferential and differential tuning of neural populations to these regularities can be demonstrated by assessing rate dependence of neural responses evoked during continuous periodic stimulation. Here, we used functional magnetic resonance imaging to measure regional variations of temporal sensitivity along the human ventral visual stream. By alternating one face and one house stimulus, we combined sufficient low-level signal modulation with changes in semantic meaning and could therefore drive all tiers of visual cortex strongly enough to assess rate dependence. We found several dissociations between early visual cortex and middle- and higher-tier regions. First, there was a progressive slowing down of stimulation rates yielding peak responses along the ventral visual stream. This finding shows the width of temporal integration windows to increase at higher hierarchical levels. Next, for fixed rates, early but not higher visual cortex responses additionally depended on the length of stimulus exposure, which may indicate increased persistence of responses to short stimuli at higher hierarchical levels. Finally, attention, which was recruited by an incidental task, interacted with stimulation rate and shifted tuning peaks toward lower frequencies. Together, these findings quantify neural response properties that are likely to be operational during natural vision and that provide putative neurofunctional substrates of mechanisms that are relevant in several psychophysical phenomena as masking and the attentional blink. Moreover, they illustrate temporal constraints for translating the deployment of attention into enhanced neural responses and thereby account for lower limits of attentional dwell time.	2015-06-22T09:43:33.394635Z	http://neurovault.org/collections/655/download																				655								Journal of Neuroscience					2016-01-27T22:00:52.484670Z					Temporal Tuning Properties along the Human Ventral Visual Stream			75									470	schwarty	http://www.jneurosci.org/cgi/doi/10.1523/JNEUROSCI.2467-12.2012																							http://neurovault.org/collections/655/												
700	10.1038/nrn2994		2015-03-27T13:47:58.386324Z	Alexander J. Shackman, Tim V. Salomons, Heleen A. Slagter, Andrew S. Fox, Jameel J. Winter and Richard J. Davidson					"Whole-brain meta-analytic (ALE) analysis of the databases featured in 

Shackman, A. J., Salomons, T. V., Slagter, H. A., Fox, A. S., Winter, J. J. & Davidson, R. J. (2011). The 
integration of negative affect, pain and cognitive control in the cingulate cortex. Nature Reviews Neuroscience, 12, 154-167. [PMC3044650]

Available at http://www.ncbi.nlm.nih.gov/pmc/articles/PMC3044650/

Data were re-analyzed using Sleuth 2.3 in March 2015. In contrast to the analyses reported in our 2011 paper, here we incorporated peaks from throughout the brain, enabling a whole-brain analysis. One study (Lee et al 2007; BMapID 7080243) was retroactively dropped from the Brainmap database and was excluded from the negative affect  re-analysis. One error in the cognitive control database was corrected. Specifically, the y-coordinates for the 2 final peaks reported by Garavan et al 2002 (BMapID 30,348, exp=2) were flipped. Analyses were based on Sleuth work files that were manually re-generated in Spring 2015. The new work  files were carefully inspected to ensure that, with the 2 exceptions noted above, they exactly matched those detailed in our 2011 paper. "	2015-03-27T13:47:58.386324Z	http://neurovault.org/collections/474/download																				474								Nature Reviews Neuroscience					2016-01-27T20:58:39.825674Z					The integration of negative affect, pain and cognitive control in the cingulate cortex			3									355	shackman	http://www.nature.com/doifinder/10.1038/nrn2994																							http://neurovault.org/collections/474/												
701	10.1038/nn.3836		2014-09-11T22:39:52.309836Z	Laurence T Hunt, Raymond J Dolan and Timothy E J Behrens	FILM standard autocorrelation correction				"Contrast maps for the paper 'Hierarchical competitions subserving multi-attribute choice', Hunt LT et al., Nature Neuroscience 2014. 

Paper abstract: 
Valuation is a key tenet of decision neuroscience, where it is generally assumed that different attributes of competing options are assimilated into unitary values. Such values are central to current neural models of choice. By contrast, psychological studies emphasize complex interactions between choice and valuation. Principles of neuronal selection also suggest that competitive inhibition may occur in early valuation stages, before option selection. We found that behavior in multi-attribute choice is best explained by a model involving competition at multiple levels of representation. This hierarchical model also explains neural signals in human brain regions previously linked to valuation, including striatum, parietal and prefrontal cortex, where activity represents within-attribute competition, competition between attributes and option selection. This multi-layered inhibition framework challenges the assumption that option values are computed before choice. Instead, our results suggest a canonical competition mechanism throughout all stages of a processing hierarchy, not simply at a final choice stage."	2014-09-11T22:39:52.309836Z	http://neurovault.org/collections/122/download			3.0			True	FLIRT	False		FMRIB's Local Analysis of Mixed Effects (FLAME)	randommixedeffects		Regression		False		both	Gamma HRF	(Gaussian-weighted least-squares straight line fitting, with sigma = 50.0 s)	122	Inclusion criteria were based on age (minimum = 18 years, maximum = 50 years), and screening for history of neurological or psychiatric illness. 		FSL	nonlinear	FMRIB's Improved Linear Model (FILM)	Regression		Nature Neuroscience					2016-01-27T21:47:52.676852Z			middle scan		Hierarchical competitions subserving multi-attribute choice	FNIRT		5		5.0					Motion correction; B0 unwarping; brain extraction, spatial smoothing		125	laurencehunt	http://www.nature.com/doifinder/10.1038/nn.3836		11.0	T2*-weighted echo-planar imaging			2.0	Siemens	Trio						FSL	6.00	49.0		20.0				eventrelated	http://neurovault.org/collections/122/	True	False	True	True	True			False		True		True
702	10.1002/brb3.495		2016-03-10T14:14:59.096636Z	Smriti Agarwal, Emmanuel A. Stamatakis, Sharon Geva and Elizabeth A. Warburton					"Unthresholded maps for the above manuscript

Figure 1
Second level subtractive analysis for words>baseline contrast for old>young groups 

Figure 2
Left insula PPI connectivity analysis using seed region as -30, 20, -14 for subtractive analysis  (old>young groups)

Figure 3
Fractional anisotropy (FA) measured on DTI for subtractive analysis young>old adults 

Figure 4
Parametric model with Reaction time (RT) applied to PPI connectivity analysis from left insula (-30, 20, -14) showing negative correlations  between functional connectivity and RT.
"	2016-08-09T17:08:04.514263Z	http://neurovault.org/collections/1244/download																				1244								Brain and Behavior					2016-08-09T17:08:19.634494Z					Dominant hemisphere functional networks compensate for structural connectivity loss to preserve phonological retrieval with aging			4									971	smriti.agarwal	http://doi.wiley.com/10.1002/brb3.495																							http://neurovault.org/collections/1244/												
705	10.1371/journal.pone.0127203		2015-04-23T20:35:48.141357Z	Rebecca D. Calcott, Elliot T. Berkman and Suliann Ben Hamed				mni	In this study, participants were required to shift their focus of attention between global and local targets.  Participants completed the task in 3 motivation conditions (approach, avoidance, neutral) as well as 3 contexts (mostly global targets, mostly local targets, even number of global and local targets). Thus, the study had a 2 (Switch vs. Non-Switch) by 2 (Target Type: global or local) by 3 (Motivation: approach, avoidance, neutral) by 3 (Context: mostly global, mostly local, even) design.	2015-04-23T20:35:48.141357Z	http://neurovault.org/collections/540/download	30.0	200.0	3.0	80.0		True	spm - Coregister: Estimate and Reslice	False			randommixedeffects				True		right			540	Normal or corrected-to-normal vision; MRI compatible; no history of psychological or neurological disorders 		spm12b				spm12b	PLOS ONE	183.0	390.0	3.75	64.0	2016-01-27T21:48:06.572614Z					Neural Correlates of Attentional Flexibility during Approach and Avoidance Motivation		96.0	22	4.0	2.0				interleaved	skull-stripping, unwarping using fieldmaps, realignment of functionals, coregistration, manual reorientation to AC-PC, normalization to MNI space using Dartel		394	rcalcott	http://dx.plos.org/10.1371/journal.pone.0127203		0.47	T2*-weighted BOLD EPI	Data series were examined for striping and motion artifacts; after cogregistration, the correspondence between structurals and functionals was checked.	2000.0		Siemens	Allegra		4.0		6.0	Gaussian Kernel	spm	12b	30.0	22.63	19.0				hybridblockevent	http://neurovault.org/collections/540/			False	True		True					True	
706	10.1016/j.neuroimage.2015.06.062	Coronal	2015-08-11T12:21:36.391331Z	Jelle R. Dalenberg, Heleen R. Hoogeveen, Remco J. Renken, Dave R.M. Langers and Gert J. ter Horst				mni	These images contain the contrast images and response maps provided in the paper. Abstract: The primary gustatory area is located in the insular cortex. Although the insular cortex has been the topic of multiple parcellation studies, its functional specialization regarding taste processing received relatively little attention. Studies investigating the brain response to taste suggested that the insular cortex is involved in processing multiple characteristics of a taste stimulus, such as its quality, intensity, and pleasantness. In the current functional magnetic resonance study, younger and older adult male subjects were exposed to four basic tastes in five increasing concentrations. We applied a data-driven analysis to obtain insular response maps, which showed that the insular cortex processes the presence of taste, its corresponding pleasantness, as well as its concentration. More specifically, the left and right insular cortices are differentially engaged in processing the aforementioned taste characteristics: representations of the presence of a taste stimulus as well as its corresponding pleasantness dominate in the left insular cortex, whereas taste concentration processing dominates in the right insular cortex. These results were similar across both age groups. Our results fit well within previous cytoarchitectural studies and show insular lateralization in processing different aspects of taste stimuli in men. 	2015-08-11T12:21:36.391331Z	http://neurovault.org/collections/754/download	30.0		3.0	7.0		True	SPM8 native	False	Combination of healthy young and older male participants.		fixedeffects		regression	SPM8 native			right	HRF	128	754	No history of taste, smell, neurological, or psychological disorders. Right handed, non-smoker for at least 3 months,. No using any form of medication affecting taste perception.		SPM8	nonlinear		regression	SPM8	NeuroImage	3.0	900.0	variable		2016-02-29T07:20:13.683860Z			mean image.	SPM8 native	Functional specialization of the male insula during taste perception	DARTEL	15.0	3	4.0	2.0	T1				Realignment, coregistration, normalization, smoothing		521	j.r.dalenberg	http://linkinghub.elsevier.com/retrieve/pii/S1053811915005674		1.0	PRESTO	Visual	0.852	2.0	Philips	Intera		3.0	PRESTO images do not require timing correction.	6.0	FWHM	SPM	8	72.0	43.84	19.0	2.0	SPM8 native		blocked	http://neurovault.org/collections/754/	False		True	True	True	True			False	False	True	
708	10.1523/JNEUROSCI.5996-10.2012		2014-08-20T13:16:26.356662Z	P. Pinel, F. Fauchereau, A. Moreno, A. Barbot, M. Lathrop, D. Zelenika, D. Le Bihan, J.-B. Poline, T. Bourgeron and S. Dehaene			bthirion		"Functional localizer to map various large-scale functional cognitive networks.

These are the various contrasts obtained by opposing the simple tasks as defined in [Pinel 2007 ""Fast reproducible identification and large-scale databasing of individual functional cognitive networks""].

The Functional Localizer is a simple and fast acquisition procedure based on a 5-minute functional magnetic resonance imaging (fMRI) sequence that can be run as easily and as systematically as an anatomical scan. This protocol captures the cerebral bases of auditory and visual perception, motor actions, reading, language comprehension and mental calculation."	2014-08-20T13:16:26.356662Z	http://neurovault.org/collections/94/download					https://brainomics.cea.fr/localizer/			False												94								Journal of Neuroscience					2016-01-27T21:48:06.454907Z					Genetic Variants of FOXP2 and KIAA0319/TTRAP/THEM2 Locus Are Associated with Altered Brain Activation in Distinct Language-Related Regions			28									103	gael.varoquaux	http://www.jneurosci.org/cgi/doi/10.1523/JNEUROSCI.5996-10.2012																							http://neurovault.org/collections/94/												
709	10.1371/journal.pone.0030920		2015-09-16T17:38:41.391682Z	Leonhard Schilbach, Danilo Bzdok, Bert Timmermans, Peter T. Fox, Angela R. Laird, Kai Vogeley, Simon B. Eickhoff and Carles Soriano-Mas					We present results of quantitative meta-analyses of neuroimaging studies, which confirm a statistical convergence in the neural correlates of social and resting state cognition. By using conjunction analyses across studies investigating social cognition, resting state, and emotion, we demonstrate significant overlap of task-related signal change in dorso-medial prefrontal and medial parietal cortex, brain regions that have recently been linked to introspective abilities. This dataset was automatically imported from the ANIMA <http://anima.modelgui.org/> database. Version: 2	2015-09-16T17:38:41.391225Z	http://neurovault.org/collections/845/download					http://anima.modelgui.org/studies/Schilbach_SocialNetworks_2012															845								PLoS ONE					2016-02-29T09:37:28.790640Z					Introspective Minds: Using ALE Meta-Analyses to Study Commonalities in the Neural Correlates of Emotional Processing, Social & Unconstrained Cognition			8									555	ANIMA	http://dx.plos.org/10.1371/journal.pone.0030920																							http://neurovault.org/collections/845/												
714	10.1093/cercor/bhs256		2015-09-16T16:44:24.268381Z	E. C. Cieslik, K. Zilles, S. Caspers, C. Roski, T. S. Kellermann, O. Jakobs, R. Langner, A. R. Laird, P. T. Fox and S. B. Eickhoff					This study shows that the right DLPFC as observed in 4 different experiments of executive action control may be subdivided into 2 distinct subregions -- an anterior-ventral and a posterior-dorsal one -- based on their whole-brain co-activation patterns across neuroimaging studies. The posterior subregion showed increased connectivity with bilateral intraparietal sulci, whereas the anterior subregion showed increased connectivity with the anterior cingulate cortex. Functional characterization revealed the anterior network to be more strongly associated with attention and action inhibition processes, whereas the posterior network was more strongly related to action execution and working memory. This dataset was automatically imported from the ANIMA <http://anima.modelgui.org/> database. Version: 2	2015-09-16T16:44:24.267915Z	http://neurovault.org/collections/825/download					http://anima.modelgui.org/studies/Cieslik_DLPFC_2013															825								Cerebral Cortex					2016-02-29T09:00:08.460856Z					"Is There ""One"" DLPFC in Cognitive Action Control? Evidence for Heterogeneity From Co-Activation-Based Parcellation"			4									555	ANIMA	http://www.cercor.oxfordjournals.org/cgi/doi/10.1093/cercor/bhs256																							http://neurovault.org/collections/825/												
715	10.1016/j.neuroimage.2013.11.001		2015-09-16T17:35:43.489284Z	N. Kohn, S.B. Eickhoff, M. Scheller, A.R. Laird, P.T. Fox and U. Habel					We here quantitatively summarize the published literature on cognitive emotion regulation using activation likelihood estimation in fMRI and PET (23 studies/479 subjects). According to our model, the superior temporal gyrus, angular gyrus and (pre) supplementary motor area should be involved in execution of regulation initiated by frontal areas. The dorsolateral prefrontal cortex may be related to regulation of cognitive processes such as attention, while the ventrolateral prefrontal cortex may not necessarily reflect the regulatory process per se, but signals salience and therefore the need to regulate. This dataset was automatically imported from the ANIMA <http://anima.modelgui.org/> database. Version: 1	2015-09-16T17:35:43.488869Z	http://neurovault.org/collections/836/download					http://anima.modelgui.org/studies/Kohn_EmotionRegulation_2014															836								NeuroImage					2016-02-29T09:36:40.706628Z					Neural network of cognitive emotion regulation — An ALE meta-analysis and MACM analysis			7									555	ANIMA	http://linkinghub.elsevier.com/retrieve/pii/S1053811913010902																							http://neurovault.org/collections/836/												
721	10.1162/jocn_a_00785		2015-03-12T00:14:43.776034Z	Robert P. Spunt, Meghan L. Meyer and Matthew D. Lieberman					Humans readily adopt an intentional stance to other people, comprehending their behavior as guided by unobservable mental states such as belief, desire, and intention. We used fMRI in healthy adults to test the hypothesis that this stance is primed by the default mode of human brain function present when the mind is at rest. We report three findings that support this hypothesis. First, brain regions activated by actively adopting an intentional rather than nonintentional stance to another person were anatomically similar to those demonstrating default responses to a fixation baseline condition. Second, moment-to-moment variation in default activity in the dorsomedial pFC was related to the ease with which participants applied an intentional-but not nonintentional-stance to a social stimulus presented moments later. Finally, individuals who showed stronger dorsomedial pFC activity at baseline in a separate task were generally more efficient when adopting the intentional stance and reported having greater social skills. These results identify a biological basis for the human tendency to adopt the intentional stance. More broadly, they suggest that the brain's default response may have evolved, in part, as a response to life in a social world.	2015-03-12T00:14:43.776034Z	http://neurovault.org/collections/446/download								False									right			446	All participants were native English speakers and were not taking psychotropic medications at the time of the study							Journal of Cognitive Neuroscience		590.0	4		2016-02-29T08:53:38.603509Z					The Default Mode of Human Brain Function Primes the Intentional Stance		3.0	6	2.0	0.0		True	https://github.com/spunt/easy-optimize-x				267	spunt	http://www.mitpressjournals.org/doi/10.1162/jocn_a_00785		0.4762														31.0	22.86	18.0				eventrelated	http://neurovault.org/collections/446/												
723	10.3758/s13415-015-0338-7		2016-04-24T19:47:57.338156Z	Henry W. Chase, Poornima Kumar, Simon B. Eickhoff and Alexandre Y. Dombrovski					A meta analysis of studies employing reinforcement learning algorithms to analyze appetitive conditioning paradigms. This dataset was automatically imported from the ANIMA <http://anima.modelgui.org/> database. Version: 1	2016-04-24T19:47:57.337433Z	http://neurovault.org/collections/1323/download					http://anima.fz-juelich.de/api/studies/Chase_ReinforcementLearningALE_2015															1323								Cognitive, Affective, & Behavioral Neuroscience					2016-04-24T19:48:04.893710Z					Reinforcement learning models and their neural correlates: An activation likelihood estimation meta-analysis			3									555	ANIMA	http://link.springer.com/10.3758/s13415-015-0338-7																							http://neurovault.org/collections/1323/												
725	10.1093/brain/awt049		2015-03-05T20:53:51.202912Z	J. M. Shine, E. Matar, P. B. Ward, S. J. Bolitho, M. Gilat, M. Pearson, S. L. Naismith and S. J. G. Lewis						2015-03-05T20:53:51.202912Z	http://neurovault.org/collections/418/download																				418								Brain					2016-06-12T22:03:23.053635Z					Exploring the cortical and subcortical functional magnetic resonance imaging changes associated with freezing in Parkinson's disease			5									330	macshine	http://www.brain.oxfordjournals.org/cgi/doi/10.1093/brain/awt049																							http://neurovault.org/collections/418/												
726	10.1371/journal.pone.0158465		2016-06-24T19:38:09.415752Z	Wuyi Wang, Shivakumar Viswanathan, Taraz Lee, Scott T. Grafton and Suliann Ben Hamed					"Cortical theta band oscillations (4-8 Hz) in EEG signals have been shown to be
important for a variety of different cognitive control operations in visual attention
paradigms. However the synchronization source of these signals as defined by fMRI
BOLD activity and the extent to which theta oscillations play a role in multimodal
attention remains unknown. Here we investigated the extent to which cross-modal
visual and auditory attention impacts theta oscillations. Using a simultaneous EEGfMRI
paradigm, healthy human participants performed an attentional vigilance task with
six cross-modal conditions using naturalistic stimuli. To assess supramodal
mechanisms, modulation of theta oscillation amplitude for attention to either visual or
auditory stimuli was correlated with BOLD activity by conjunction analysis. Negative
correlation was localized to cortical regions associated with the default mode network
and positively with ventral premotor areas. Modality-associated attention to visual
stimuli was marked by a positive correlation of theta and BOLD activity in frontoparietal
area that was not observed in the auditory condition. A positive correlation of
theta and BOLD activity was observed in auditory cortex, while a negative correlation
of theta and BOLD activity was observed in visual cortex during auditory attention. The
data support a supramodal interaction of theta activity with of DMN function, and
modality-associated processes within fronto-parietal networks related to top-down
theta related cognitive control in cross-modal visual attention. On the other hand, in
sensory cortices there are opposing effects of theta activity during cross-modal
auditory attention."	2016-07-13T17:51:46.447085Z	http://neurovault.org/collections/1486/download			3.0														right			1486								PLOS ONE	12.0	800.0	1.5		2016-07-13T17:52:04.257287Z					Coupling between Theta Oscillations and Cognitive Control Network during Cross-Modal Visual and Auditory Attention: Supramodal vs Modality-Specific Mechanisms			5	6.0	2.0							1136	wuyiwang	http://dx.plos.org/10.1371/journal.pone.0158465		0.5					Siemens							AFNI		26.0	22.4	18.0				hybridblockevent	http://neurovault.org/collections/1486/												
728	10.1073/pnas.1522551113		2015-06-01T22:49:27.879232Z	Dobromir Rahnev, Derek Evan Nee, Justin Riddle, Alina Sue Larson and Mark D’Esposito					Statistical maps for each epoch of the task: (1) instruction, (2) stimulus/perceptual judgment, and (3) confidence.	2016-05-10T14:10:48.371029Z	http://neurovault.org/collections/599/download																				599								Proceedings of the National Academy of Sciences					2016-06-12T23:04:42.870202Z					Causal evidence for frontal cortex organization for perceptual decision making			3									442	rahnev	http://www.pnas.org/lookup/doi/10.1073/pnas.1522551113																							http://neurovault.org/collections/599/												
729	10.1016/j.neuroimage.2012.03.012		2016-05-17T10:33:02.629496Z	Charlotte E. Hartwright, Ian A. Apperly and Peter C. Hansen					Belief–desire reasoning is a core component of ‘Theory of Mind’ (ToM), which can be used to explain and predict the behaviour of agents. Neuroimaging studies reliably identify a network of brain regions comprising a ‘standard’ network for ToM, including temporoparietal junction and medial prefrontal cortex. Whilst considerable experimental evidence suggests that executive control (EC) may support a functioning ToM, co-ordination of neural systems for ToM and EC is poorly understood. We report here use of a novel task in which psychologically relevant ToM parameters (true versus false belief; approach versus avoidance desire) were manipulated orthogonally. The valence of these parameters not only modulated brain activity in the ‘standard’ ToM network but also in EC regions. Varying the valence of both beliefs and desires recruits anterior cingulate cortex, suggesting a shared inhibitory component associated with negatively valenced mental state concepts. Varying the valence of beliefs additionally draws on ventrolateral prefrontal cortex, reflecting the need to inhibit self perspective. These data provide the first evidence that separate functional and neural systems for EC may be recruited in the service of different aspects of ToM.	2016-05-17T10:33:02.629084Z	http://neurovault.org/collections/1377/download																				1377								NeuroImage					2016-05-17T11:16:19.290281Z					Multiple roles for executive control in belief–desire reasoning: Distinct neural networks are recruited for self perspective inhibition and complexity of reasoning			3									1071	cehartwright	http://linkinghub.elsevier.com/retrieve/pii/S1053811912002844																							http://neurovault.org/collections/1377/												
